{
  "schemaVersion": 1,
  "scenarioId": "rhpp-long-distance-conflict",
  "seed": 7,
  "endTimeMs": 3600000,
  "vehicles": [
    {"vehicleId": "fork-001", "robotGroup": "fork", "initialNodeId": "fork:PP1171", "initialHeadingRad": 0.0, "initialLoadState": "empty"},
    {"vehicleId": "fork-002", "robotGroup": "fork", "initialNodeId": "fork:PP1172", "initialHeadingRad": 0.0, "initialLoadState": "empty"},
    {"vehicleId": "fork-003", "robotGroup": "fork", "initialNodeId": "fork:PP1173", "initialHeadingRad": -3.141593, "initialLoadState": "empty"},
    {"vehicleId": "fork-004", "robotGroup": "fork", "initialNodeId": "fork:PP1174", "initialHeadingRad": -1.570796, "initialLoadState": "empty"},
    {"vehicleId": "fork-005", "robotGroup": "fork", "initialNodeId": "fork:PP1175", "initialHeadingRad": -1.570796, "initialLoadState": "empty"},
    {"vehicleId": "fork-006", "robotGroup": "fork", "initialNodeId": "fork:CP1039", "initialHeadingRad": -3.141593, "initialLoadState": "empty"},
    {"vehicleId": "jack-001", "robotGroup": "jack", "initialNodeId": "jack:PP363", "initialHeadingRad": -1.570796, "initialLoadState": "empty"},
    {"vehicleId": "jack-002", "robotGroup": "jack", "initialNodeId": "jack:PP365", "initialHeadingRad": -1.570796, "initialLoadState": "empty"},
    {"vehicleId": "jack-003", "robotGroup": "jack", "initialNodeId": "jack:PP367", "initialHeadingRad": -1.570796, "initialLoadState": "empty"},
    {"vehicleId": "jack-004", "robotGroup": "jack", "initialNodeId": "jack:PP399", "initialHeadingRad": -1.570796, "initialLoadState": "empty"},
    {"vehicleId": "jack-005", "robotGroup": "jack", "initialNodeId": "jack:PP695", "initialHeadingRad": 0.0, "initialLoadState": "empty"},
    {"vehicleId": "jack-006", "robotGroup": "jack", "initialNodeId": "jack:PP696", "initialHeadingRad": 0.0, "initialLoadState": "empty"},
    {"vehicleId": "jack-007", "robotGroup": "jack", "initialNodeId": "jack:CP49", "initialHeadingRad": -3.141593, "initialLoadState": "empty"},
    {"vehicleId": "jack-008", "robotGroup": "jack", "initialNodeId": "jack:CP50", "initialHeadingRad": 0.0, "initialLoadState": "empty"}
  ],
  "tasks": [
    {"taskId": "long-jack-001", "releaseTimeMs": 0, "pickupNodeId": "jack:AP106", "dropoffNodeId": "jack:AP475", "requiredRobotGroup": "jack", "payloadType": "shelf", "payloadId": "long-shelf-001", "pickupServiceMs": 5000, "dropoffServiceMs": 5000, "priorityClass": 2},
    {"taskId": "long-jack-002", "releaseTimeMs": 0, "pickupNodeId": "jack:AP475", "dropoffNodeId": "jack:AP106", "requiredRobotGroup": "jack", "payloadType": "shelf", "payloadId": "long-shelf-002", "pickupServiceMs": 5000, "dropoffServiceMs": 5000, "priorityClass": 2},
    {"taskId": "long-jack-003", "releaseTimeMs": 0, "pickupNodeId": "jack:AP111", "dropoffNodeId": "jack:AP467", "requiredRobotGroup": "jack", "payloadType": "shelf", "payloadId": "long-shelf-003", "pickupServiceMs": 5000, "dropoffServiceMs": 5000, "priorityClass": 1},
    {"taskId": "long-jack-004", "releaseTimeMs": 0, "pickupNodeId": "jack:AP467", "dropoffNodeId": "jack:AP111", "requiredRobotGroup": "jack", "payloadType": "shelf", "payloadId": "long-shelf-004", "pickupServiceMs": 5000, "dropoffServiceMs": 5000, "priorityClass": 1},
    {"taskId": "long-jack-005", "releaseTimeMs": 0, "pickupNodeId": "jack:AP114", "dropoffNodeId": "jack:AP475", "requiredRobotGroup": "jack", "payloadType": "shelf", "payloadId": "long-shelf-005", "pickupServiceMs": 5000, "dropoffServiceMs": 5000, "priorityClass": 1},
    {"taskId": "long-jack-006", "releaseTimeMs": 0, "pickupNodeId": "jack:AP475", "dropoffNodeId": "jack:AP114", "requiredRobotGroup": "jack", "payloadType": "shelf", "payloadId": "long-shelf-006", "pickupServiceMs": 5000, "dropoffServiceMs": 5000, "priorityClass": 1},
    {"taskId": "long-jack-007", "releaseTimeMs": 0, "pickupNodeId": "jack:AP107", "dropoffNodeId": "jack:AP467", "requiredRobotGroup": "jack", "payloadType": "shelf", "payloadId": "long-shelf-007", "pickupServiceMs": 5000, "dropoffServiceMs": 5000, "priorityClass": 0},
    {"taskId": "long-jack-008", "releaseTimeMs": 0, "pickupNodeId": "jack:AP467", "dropoffNodeId": "jack:AP107", "requiredRobotGroup": "jack", "payloadType": "shelf", "payloadId": "long-shelf-008", "pickupServiceMs": 5000, "dropoffServiceMs": 5000, "priorityClass": 0},
    {"taskId": "long-jack-009", "releaseTimeMs": 0, "pickupNodeId": "jack:AP105", "dropoffNodeId": "jack:AP474", "requiredRobotGroup": "jack", "payloadType": "shelf", "payloadId": "long-shelf-009", "pickupServiceMs": 5000, "dropoffServiceMs": 5000, "priorityClass": 1},
    {"taskId": "long-jack-010", "releaseTimeMs": 0, "pickupNodeId": "jack:AP474", "dropoffNodeId": "jack:AP105", "requiredRobotGroup": "jack", "payloadType": "shelf", "payloadId": "long-shelf-010", "pickupServiceMs": 5000, "dropoffServiceMs": 5000, "priorityClass": 1},
    {"taskId": "long-jack-011", "releaseTimeMs": 0, "pickupNodeId": "jack:AP113", "dropoffNodeId": "jack:AP466", "requiredRobotGroup": "jack", "payloadType": "shelf", "payloadId": "long-shelf-011", "pickupServiceMs": 5000, "dropoffServiceMs": 5000, "priorityClass": 0},
    {"taskId": "long-jack-012", "releaseTimeMs": 0, "pickupNodeId": "jack:AP466", "dropoffNodeId": "jack:AP113", "requiredRobotGroup": "jack", "payloadType": "shelf", "payloadId": "long-shelf-012", "pickupServiceMs": 5000, "dropoffServiceMs": 5000, "priorityClass": 0},
    {"taskId": "long-fork-001", "releaseTimeMs": 0, "pickupNodeId": "fork:AP1133", "dropoffNodeId": "fork:AP1207", "requiredRobotGroup": "fork", "payloadType": "pallet", "payloadId": "long-pallet-001", "pickupServiceMs": 5000, "dropoffServiceMs": 5000, "priorityClass": 2},
    {"taskId": "long-fork-002", "releaseTimeMs": 0, "pickupNodeId": "fork:AP1207", "dropoffNodeId": "fork:AP1133", "requiredRobotGroup": "fork", "payloadType": "pallet", "payloadId": "long-pallet-002", "pickupServiceMs": 5000, "dropoffServiceMs": 5000, "priorityClass": 2},
    {"taskId": "long-fork-003", "releaseTimeMs": 0, "pickupNodeId": "fork:AP1135", "dropoffNodeId": "fork:AP1209", "requiredRobotGroup": "fork", "payloadType": "pallet", "payloadId": "long-pallet-003", "pickupServiceMs": 5000, "dropoffServiceMs": 5000, "priorityClass": 1},
    {"taskId": "long-fork-004", "releaseTimeMs": 0, "pickupNodeId": "fork:AP1209", "dropoffNodeId": "fork:AP1135", "requiredRobotGroup": "fork", "payloadType": "pallet", "payloadId": "long-pallet-004", "pickupServiceMs": 5000, "dropoffServiceMs": 5000, "priorityClass": 1},
    {"taskId": "long-fork-005", "releaseTimeMs": 0, "pickupNodeId": "fork:AP1137", "dropoffNodeId": "fork:AP1206", "requiredRobotGroup": "fork", "payloadType": "pallet", "payloadId": "long-pallet-005", "pickupServiceMs": 5000, "dropoffServiceMs": 5000, "priorityClass": 1},
    {"taskId": "long-fork-006", "releaseTimeMs": 0, "pickupNodeId": "fork:AP1206", "dropoffNodeId": "fork:AP1137", "requiredRobotGroup": "fork", "payloadType": "pallet", "payloadId": "long-pallet-006", "pickupServiceMs": 5000, "dropoffServiceMs": 5000, "priorityClass": 1},
    {"taskId": "long-fork-007", "releaseTimeMs": 0, "pickupNodeId": "fork:AP1126", "dropoffNodeId": "fork:AP1207", "requiredRobotGroup": "fork", "payloadType": "pallet", "payloadId": "long-pallet-007", "pickupServiceMs": 5000, "dropoffServiceMs": 5000, "priorityClass": 0},
    {"taskId": "long-fork-008", "releaseTimeMs": 0, "pickupNodeId": "fork:AP1207", "dropoffNodeId": "fork:AP1126", "requiredRobotGroup": "fork", "payloadType": "pallet", "payloadId": "long-pallet-008", "pickupServiceMs": 5000, "dropoffServiceMs": 5000, "priorityClass": 0},
    {"taskId": "long-fork-009", "releaseTimeMs": 0, "pickupNodeId": "fork:AP1188", "dropoffNodeId": "fork:AP1200", "requiredRobotGroup": "fork", "payloadType": "pallet", "payloadId": "long-pallet-009", "pickupServiceMs": 5000, "dropoffServiceMs": 5000, "priorityClass": 1},
    {"taskId": "long-fork-010", "releaseTimeMs": 0, "pickupNodeId": "fork:AP1200", "dropoffNodeId": "fork:AP1188", "requiredRobotGroup": "fork", "payloadType": "pallet", "payloadId": "long-pallet-010", "pickupServiceMs": 5000, "dropoffServiceMs": 5000, "priorityClass": 1},
    {"taskId": "long-fork-011", "releaseTimeMs": 0, "pickupNodeId": "fork:AP1215", "dropoffNodeId": "fork:AP2459", "requiredRobotGroup": "fork", "payloadType": "pallet", "payloadId": "long-pallet-011", "pickupServiceMs": 5000, "dropoffServiceMs": 5000, "priorityClass": 0},
    {"taskId": "long-fork-012", "releaseTimeMs": 0, "pickupNodeId": "fork:AP2459", "dropoffNodeId": "fork:AP1215", "requiredRobotGroup": "fork", "payloadType": "pallet", "payloadId": "long-pallet-012", "pickupServiceMs": 5000, "dropoffServiceMs": 5000, "priorityClass": 0}
  ]
}
