{
  "schemaVersion": 1,
  "scenarioId": "phase2-continuous-tasks",
  "seed": 0,
  "endTimeMs": 400000,
  "vehicles": [
    {
      "vehicleId": "fork-001",
      "robotGroup": "fork",
      "initialNodeId": "fork:PP1171",
      "initialHeadingRad": 0.0,
      "initialLoadState": "empty"
    },
    {
      "vehicleId": "fork-002",
      "robotGroup": "fork",
      "initialNodeId": "fork:PP1172",
      "initialHeadingRad": 0.0,
      "initialLoadState": "empty"
    }
  ],
  "tasks": [
    {
      "taskId": "phase2-task-001",
      "releaseTimeMs": 0,
      "pickupNodeId": "fork:AP1123",
      "dropoffNodeId": "fork:AP2121",
      "requiredRobotGroup": "fork",
      "payloadType": "pallet",
      "payloadId": "pallet-001",
      "priorityClass": 0
    },
    {
      "taskId": "phase2-task-002",
      "releaseTimeMs": 5000,
      "pickupNodeId": "fork:AP1119",
      "dropoffNodeId": "fork:AP1126",
      "requiredRobotGroup": "fork",
      "payloadType": "pallet",
      "payloadId": "pallet-002",
      "priorityClass": 1
    },
    {
      "taskId": "phase2-task-003",
      "releaseTimeMs": 60000,
      "pickupNodeId": "fork:AP1113",
      "dropoffNodeId": "fork:AP1116",
      "requiredRobotGroup": "fork",
      "payloadType": "pallet",
      "payloadId": "pallet-003",
      "priorityClass": 0
    }
  ]
}
