{
  "schemaVersion": 1,
  "scenarioId": "phase3-rh-pp-benchmark",
  "seed": 0,
  "endTimeMs": 500000,
  "vehicles": [
    {
      "vehicleId": "fork-001",
      "robotGroup": "fork",
      "initialNodeId": "fork:PP1171",
      "initialHeadingRad": 0.0,
      "initialLoadState": "empty"
    },
    {
      "vehicleId": "fork-002",
      "robotGroup": "fork",
      "initialNodeId": "fork:PP1172",
      "initialHeadingRad": 0.0,
      "initialLoadState": "empty"
    },
    {
      "vehicleId": "fork-003",
      "robotGroup": "fork",
      "initialNodeId": "fork:PP1173",
      "initialHeadingRad": 0.0,
      "initialLoadState": "empty"
    }
  ],
  "tasks": [
    {
      "taskId": "phase3-task-001",
      "releaseTimeMs": 0,
      "pickupNodeId": "fork:AP1123",
      "dropoffNodeId": "fork:AP2121",
      "requiredRobotGroup": "fork",
      "payloadType": "pallet",
      "payloadId": "phase3-pallet-001",
      "priorityClass": 1,
      "dueTimeMs": 140000
    },
    {
      "taskId": "phase3-task-002",
      "releaseTimeMs": 0,
      "pickupNodeId": "fork:AP1119",
      "dropoffNodeId": "fork:AP1126",
      "requiredRobotGroup": "fork",
      "payloadType": "pallet",
      "payloadId": "phase3-pallet-002",
      "priorityClass": 0,
      "dueTimeMs": 140000
    },
    {
      "taskId": "phase3-task-003",
      "releaseTimeMs": 0,
      "pickupNodeId": "fork:AP1113",
      "dropoffNodeId": "fork:AP1116",
      "requiredRobotGroup": "fork",
      "payloadType": "pallet",
      "payloadId": "phase3-pallet-003",
      "priorityClass": 2,
      "dueTimeMs": 140000
    },
    {
      "taskId": "phase3-task-004",
      "releaseTimeMs": 90000,
      "pickupNodeId": "fork:AP1123",
      "dropoffNodeId": "fork:AP1126",
      "requiredRobotGroup": "fork",
      "payloadType": "pallet",
      "payloadId": "phase3-pallet-004",
      "priorityClass": 1,
      "dueTimeMs": 300000
    },
    {
      "taskId": "phase3-task-005",
      "releaseTimeMs": 90000,
      "pickupNodeId": "fork:AP1119",
      "dropoffNodeId": "fork:AP2121",
      "requiredRobotGroup": "fork",
      "payloadType": "pallet",
      "payloadId": "phase3-pallet-005",
      "priorityClass": 0,
      "dueTimeMs": 300000
    }
  ]
}
